{
  "$schema": "./public-surface-catalog.schema.json",
  "catalogVersion": 1,
  "generatedFrom": "durable docs truth on main",
  "publicSurfaces": [
    {
      "surface": "HTTP/API",
      "status": "supported now",
      "truthfulMeaning": "Current public frontdoor carries durable runtime discovery, auth, remediation, acquisition, and invoke HTTP routes.",
      "sourceAnchors": [
        "docs/api/openapi.yaml",
        "docs/api/service-http-reference.md",
        "packages/surfaces/http/src/http-surface.ts",
        "packages/surfaces/http/src/service-language.ts"
      ]
    },
    {
      "surface": "SDK/client",
      "status": "partial",
      "truthfulMeaning": "BYOK SDK, service client, and web helper exist, but they do not replace the service/runtime substrate as the primary public frontdoor.",
      "sourceAnchors": [
        "docs/api/sdk-quickstart.md",
        "packages/sdk/src/index.ts",
        "packages/surfaces/sdk-client/src/service-client.ts"
      ]
    },
    {
      "surface": "CLI",
      "status": "partial",
      "truthfulMeaning": "Read-only builder/runtime helper is landed; it is not an execution brain or distribution commitment.",
      "sourceAnchors": [
        "scripts/webai-bridge-cli.mjs",
        "tests/unit/web/webai-bridge-cli.test.ts",
        ".agents/internal-docs/blueprints/wave6-outward-packaging-threshold.md"
      ],
      "readOnly": true,
      "commands": [
        "providers",
        "health",
        "runtime-doctor",
        "runtime-plan",
        "auth-status",
        "provider-status",
        "provider-doctor",
        "provider-probe",
        "provider-remediation",
        "provider-current-page",
        "provider-current-console",
        "provider-current-network",
        "provider-store-readiness",
        "provider-live-readiness",
        "provider-attach-target",
        "provider-diagnose-ladder",
        "provider-support-bundle",
        "provider-diagnose",
        "surface-catalog",
        "surface-catalog-schema",
        "compat-target-catalog",
        "compat-target-catalog-schema",
        "compat-targets",
        "compat-target",
        "builder-kit-catalog",
        "builder-kit-catalog-schema",
        "builder-kits",
        "builder-kit",
        "skill-pack-catalog",
        "skill-pack-catalog-schema",
        "skill-packs",
        "skill-pack",
        "skill-pack-routes",
        "skill-pack-routes-schema",
        "skill-pack-route",
        "host-playbooks",
        "host-playbooks-schema",
        "host-playbook",
        "host-examples",
        "host-examples-schema",
        "host-example",
        "builder-journeys",
        "builder-journeys-schema",
        "builder-journey",
        "builder-intent-router",
        "builder-intent-router-schema",
        "builder-intent",
        "keyword-truth",
        "keyword-truth-schema",
        "keyword-entry",
        "provider-catalog",
        "provider-catalog-schema",
        "provider-entry",
        "starter-manifests",
        "starter-manifests-schema",
        "starter-examples",
        "starter-examples-schema",
        "starter-pack-index",
        "starter-pack-index-schema",
        "starter-pack-entry",
        "starter-pack-chooser",
        "starter-pack-chooser-schema",
        "starter-pack-scenario",
        "starter-pack-comparison",
        "starter-pack-comparison-schema",
        "starter-pack-filter",
        "builder-template",
        "builder-example",
        "skill-template",
        "skill-example",
        "mcp-status",
        "mcp-tools",
        "mcp-tool-catalog",
        "mcp-tool-catalog-schema",
        "mcp-tool"
      ]
    },
    {
      "surface": "MCP",
      "status": "partial",
      "truthfulMeaning": "A read-only stdio MCP server/tool surface is landed on main and delegates to the same runtime inspection substrate, but it is not an execution brain or full consumer-parity backend.",
      "sourceAnchors": [
        "docs/mcp.md",
        "packages/surfaces/mcp/src/index.ts",
        "scripts/webai-bridge-mcp.mjs",
        "tests/unit/mcp/webai-bridge-mcp.test.ts"
      ],
      "readOnly": true
    },
    {
      "surface": "i18n",
      "status": "partial",
      "truthfulMeaning": "The default public front door is English-first; bilingual helper pages remain available, but they do not define the main landing path.",
      "sourceAnchors": [
        "docs/i18n.md",
        "README.md",
        "docs/README.md"
      ]
    }
  ],
  "compatTargets": [
    {
      "target": "codex",
      "status": "partial",
      "builderFacing": true,
      "failClosed": true,
      "transport": "responses",
      "route": "/v1/runtime/invoke",
      "supportedModes": [
        "chat",
        "plan",
        "copilot-brain"
      ],
      "truthfulMeaning": "Thin fail-closed runtime adapter is landed for text/runtime delegation only.",
      "notYetSupported": [
        "tool-execution",
        "mcp-execution",
        "execution-brain",
        "terminal-shell",
        "approval-ui",
        "browser-automation"
      ],
      "notes": [
        "builder-facing runtime adapter only",
        "no tool or MCP parity"
      ],
      "sourceAnchors": [
        "docs/compat/codex.md",
        "packages/consumers/codex/src/index.ts",
        "tests/unit/compat/codex-consumer.test.ts"
      ]
    },
    {
      "target": "claude-code",
      "status": "partial",
      "builderFacing": true,
      "failClosed": true,
      "transport": "anthropic-compatible",
      "route": "/v1/runtime/invoke",
      "supportedModes": [
        "chat",
        "plan",
        "copilot-brain"
      ],
      "truthfulMeaning": "Thin fail-closed message/runtime bridge is landed, but terminal, approval, tool, and MCP parity are not.",
      "notYetSupported": [
        "tool-execution",
        "mcp-execution",
        "execution-brain",
        "terminal-shell",
        "approval-ui",
        "browser-automation"
      ],
      "notes": [
        "builder-facing runtime adapter only",
        "header/body fidelity bridge is intentionally thin",
        "no terminal shell, tool plane, or MCP parity"
      ],
      "sourceAnchors": [
        "docs/compat/claude-code.md",
        "packages/consumers/claude-code/src/index.ts",
        "tests/unit/compat/claude-code-consumer.test.ts"
      ]
    },
    {
      "target": "openclaw",
      "status": "partial",
      "builderFacing": true,
      "failClosed": true,
      "transport": "delegated-runtime",
      "route": "/v1/runtime/invoke",
      "supportedModes": [
        "chat",
        "plan",
        "copilot-brain"
      ],
      "truthfulMeaning": "Delegation-first thin runtime bridge is landed, but operator/control-plane/product-shell parity is not.",
      "notYetSupported": [
        "tool-execution",
        "mcp-execution",
        "execution-brain",
        "terminal-shell",
        "approval-ui",
        "browser-automation"
      ],
      "notes": [
        "future consumer-side adapter only",
        "provider/runtime delegation without product-shell inheritance",
        "no operator control plane or channel shell parity"
      ],
      "sourceAnchors": [
        "docs/compat/openclaw.md",
        "packages/consumers/openclaw/src/index.ts",
        "tests/unit/compat/openclaw-consumer.test.ts"
      ]
    }
  ],
  "builderKits": [
    {
      "target": "codex",
      "status": "partial",
      "starterShape": "responses-runtime-helper",
      "bestEntry": "pnpm run webai-bridge:cli -- compat-target --target codex",
      "requiredInputs": [
        "service runtime base URL",
        "Codex-side request text",
        "explicit provider/lane choice when the target provider is dual-lane"
      ],
      "starterSteps": [
        "Read the Codex compat target truth first.",
        "Point the helper at the current WebaiBridge service runtime base URL.",
        "Keep the helper text-only and delegate actual invocation through the thin compat adapter.",
        "Expose unsupported features as fail-closed instead of silently dropping them."
      ],
      "outputArtifacts": [
        "builder-side runtime helper",
        "thin request bridge",
        "truthful status page or README snippet"
      ],
      "safeClaims": [
        "partial Codex compatibility",
        "thin runtime bridge",
        "fail-closed builder helper"
      ],
      "recommendedDocs": [
        "docs/starter-pack-chooser.md",
        "catalogs/starter-pack-comparison.json",
        "docs/host-integration-playbooks.md",
        "docs/host-integration-examples.md",
        "docs/compat/codex.md",
        "docs/public-surface-support-matrix.md",
        "starter-packs/README.md"
      ],
      "copyReadyPackPath": "starter-packs/builders/codex",
      "notYetSupported": [
        "tool-execution parity",
        "mcp parity",
        "worktree parity"
      ]
    },
    {
      "target": "claude-code",
      "status": "partial",
      "starterShape": "message-runtime-helper",
      "bestEntry": "pnpm run webai-bridge:cli -- compat-target --target claude-code",
      "requiredInputs": [
        "service runtime base URL",
        "Claude Code-style message payload",
        "explicit target provider when multiple providers fit the model family"
      ],
      "starterSteps": [
        "Read the Claude Code compat truth page first.",
        "Normalize the message payload into the thin runtime bridge shape.",
        "Delegate through the existing WebaiBridge runtime invoke route.",
        "Keep tool or terminal claims fail-closed and visibly unsupported."
      ],
      "outputArtifacts": [
        "message/runtime bridge helper",
        "gateway-format adapter",
        "fail-closed compatibility note"
      ],
      "safeClaims": [
        "partial Claude Code compatibility",
        "thin message/runtime bridge",
        "no terminal or tool parity"
      ],
      "recommendedDocs": [
        "docs/starter-pack-chooser.md",